{
  "meta": {
    "variant": "source",
    "version": "0.2.0",
    "dateCreated": "2020-03-31T09:04:10.3+02:00",
    "generator": {
      "softwareName": "SB01Import",
      "softwareVersion": "0.0.0"
    },
    "comments": ["Initial commit, autogenerated from org.vrs in PT8."],
    "defaultLanguage": "en"
  },
  "idServers": {
    "idServerKey": {
      "id": "http://foo.baa"
    }
  },
  "identification": {
    "idServer": "foo",
    "name": {
      "eng": "\"Original\" Versification"
    },
    "description": {
      "eng": "The versification scheme known as org in Paratext"
    },
    "systemId": {
      "foo": {
        "id": "foo::123",
        "revision": "1"
      }
    }
  },
  "confidentiality": {
    "metadata": "unrestricted",
    "ingredients": "unrestricted"
  },
  "type": {
    "flavorType": {
      "name": "peripheral",
      "flavor": {
        "name": "versification"
      }
    }
  },
  "ingredients": {
    "org_vrs.json": {
      "mimeType": "application/json",
      "checksum": {
        "md5": "39e81428079f566e96a10827b1f57df5"
      },
      "size": 123
    }
  }
}
